anime_id,provider,external_id,source_title,romaji_title,english_title,native_title,source_description,genres,season_year,season,format,anime_status,average_score,episodes,image_url,site_url,ko_title,ko_description,ko_source,ko_status,ko_failure_reason,pending,item_csv,updated_at
4738,KITSU,41370,Demon Slayer: Kimetsu no Yaiba,Kimetsu no Yaiba,Demon Slayer: Kimetsu no Yaiba,鬼滅の刃,"It is the Taisho Period in Japan. Tanjiro, a kindhearted boy who sells charcoal for a living, finds his family slaughtered by a demon. To make matters worse, his younger sister Nezuko, the sole survivor, has been transformed into a demon herself. Though devastated by this grim reality, Tanjiro resolves to become a “demon slayer” so that he can turn his sister back into a human, and kill the demon that massacred his family.

(Source: Crunchyroll)",,2019,,TV,finished,862,26,https://media.kitsu.app/anime/poster_images/41370/original.jpg,,,,,PENDING,,YES,data\anime_csv\items\KITSU_41370.csv,2026-05-02T16:50:48
4745,KITSU,41982,Attack on Titan Season 3 Part 2,Shingeki no Kyojin Season 3 Part 2,Attack on Titan Season 3 Part 2,進撃の巨人 Season 3 Part 2,"The battle to retake Wall Maria begins now! With Eren’s new hardening ability, the Scouts are confident they can seal the wall and take back Shiganshina District. If they succeed, Eren can finally unlock the secrets of the basement—and the world. But danger lies in wait as Reiner, Bertholdt, and the Beast Titan have plans of their own. Could this be humanity’s final battle for survival?

(Source: Funimation)",,2019,,TV,finished,847,10,https://media.kitsu.app/anime/poster_images/41982/original.jpg,,,,,PENDING,,YES,data\anime_csv\items\KITSU_41982.csv,2026-05-02T16:50:48
4729,KITSU,7442,Attack on Titan,Shingeki no Kyojin,Attack on Titan,進撃の巨人,"Centuries ago, mankind was slaughtered to near extinction by monstrous humanoid creatures called titans, forcing humans to hide in fear behind enormous concentric walls. What makes these giants truly terrifying is that their taste for human flesh is not born out of hunger but what appears to be out of pleasure. To ensure their survival, the remnants of humanity began living within defensive barriers, resulting in one hundred years without a single titan encounter. However, that fragile calm is soon shattered when a colossal titan manages to breach the supposedly impregnable outer wall, reigniting the fight for survival against the man-eating abominations.

After witnessing a horrific personal loss at the hands of the invading creatures, Eren Yeager dedicates his life to their eradication by enlisting into the Survey Corps, an elite military unit that combats the merciless humanoids outside the protection of the walls. Based on Hajime Isayama's award-winning manga, Shingeki no Kyojin follows Eren, along with his adopted sister Mikasa Ackerman and his childhood friend Armin Arlert, as they join the brutal war against the titans and race to discover a way of defeating them before the last walls are breached.

(Source: MAL Rewrite)",,2013,,TV,finished,845,25,https://media.kitsu.app/anime/poster_images/7442/original.jpg,,,,,PENDING,,YES,data\anime_csv\items\KITSU_7442.csv,2026-05-02T16:50:48
4737,KITSU,6448,Hunter x Hunter (2011),Hunter x Hunter (2011),Hunter x Hunter (2011),HUNTER×HUNTER ハンターハンター,"Hunter x Hunter is set in a world where Hunters exist to perform all manner of dangerous tasks like capturing criminals and bravely searching for lost treasures in uncharted territories. Twelve-year-old Gon Freecss is determined to become the best Hunter possible in hopes of finding his father, who was a Hunter himself and had long ago abandoned his young son. However, Gon soon realizes the path to achieving his goals is far more challenging than he could have ever imagined.

Along the way to becoming an official Hunter, Gon befriends the lively doctor-in-training Leorio, vengeful Kurapika, and rebellious ex-assassin Killua. To attain their own goals and desires, together the four of them take the Hunter Exam, notorious for its low success rate and high probability of death. Throughout their journey, Gon and his friends embark on an adventure that puts them through many hardships and struggles. They will meet a plethora of monsters, creatures, and characters—all while learning what being a Hunter truly means.

(Source: MAL Rewrite)",,2011,,TV,finished,842,148,https://media.kitsu.app/anime/poster_images/6448/original.png,,,,,PENDING,,YES,data\anime_csv\items\KITSU_6448.csv,2026-05-02T16:50:48
4743,KITSU,13569,Attack on Titan Season 3,Shingeki no Kyojin Season 3,Attack on Titan Season 3,進撃の巨人 Season 3,"After recovering Eren and Historia, the recruits are put under the care of Levi. Stuck out in the middle of nowhere, Hange subjects Eren to a series of experiments in an attempt to find out more about his ability. But when their link to the secrets behind the wall is murdered, the squad must move out and find a new refuge. Except, a figure from Levi’s past has his own plans to stop them.

(Source: Funimation)",,2018,,TV,finished,841,12,https://media.kitsu.app/anime/poster_images/13569/original.jpg,,,,,PENDING,,YES,data\anime_csv\items\KITSU_13569.csv,2026-05-02T16:50:48
4742,KITSU,12,One Piece,One Piece,One Piece,ONE PIECE,"Gol D. Roger was known as the ""Pirate King,"" the strongest and most infamous being to have sailed the Grand Line. The capture and death of Roger by the World Government brought a change throughout the world. His last words before his death revealed the existence of the greatest treasure in the world, One Piece. It was this revelation that brought about the Grand Age of Pirates, men who dreamed of finding One Piece—which promises an unlimited amount of riches and fame—and quite possibly the pinnacle of glory and the title of the Pirate King.
Enter Monkey D. Luffy, a 17-year-old boy who defies your standard definition of a pirate. Rather than the popular persona of a wicked, hardened, toothless pirate ransacking villages for fun, Luffy’s reason for being a pirate is one of pure wonder: the thought of an exciting adventure that leads him to intriguing people and ultimately, the promised treasure. Following in the footsteps of his childhood hero, Luffy and his crew travel across the Grand Line, experiencing crazy adventures, unveiling dark mysteries and battling strong enemies, all in order to reach the most coveted of all fortunes—One Piece.
[Written by MAL Rewrite]",,1999,,TV,current,840,,https://media.kitsu.app/anime/poster_images/12/original.png,,,,,PENDING,,YES,data\anime_csv\items\KITSU_12.csv,2026-05-02T16:50:48
4740,KITSU,10028,A Silent Voice,Koe no Katachi,A Silent Voice,聲の形,"Shoya is a bully. When Shoko, a girl who can't hear, enters his elementary school class, she becomes their favorite target, and Shoya and his friends goad each other into devising new tortures for her. But the children's cruelty goes too far. Shoko is forced to leave the school, and Shoya ends up shouldering all the blame. Six years later, the two meet again. Can Shoya make up for his past mistakes, or is it too late?

(Source: Kodansha Comics)",,2016,,MOVIE,finished,837,1,https://media.kitsu.app/anime/poster_images/10028/original.jpeg,,,,,PENDING,,YES,data\anime_csv\items\KITSU_10028.csv,2026-05-02T16:50:48
4733,KITSU,13881,My Hero Academia Season 3,Boku no Hero Academia 3,My Hero Academia Season 3,僕のヒーローアカデミア３,"Summer is here, and the heroes of Class 1-A and 1-B are in for the toughest training camp of their lives! A group of seasoned pros pushes everyone's Quirks to new heights as the students face one overwhelming challenge after another. Braving the elements in this secret location becomes the least of their worries when routine training turns into a critical struggle for survival.

(Source: Crunchyroll)",,2018,,TV,finished,836,25,https://media.kitsu.app/anime/poster_images/13881/original.jpg,,,,,PENDING,,YES,data\anime_csv\items\KITSU_13881.csv,2026-05-02T16:50:48
4741,KITSU,8671,Attack on Titan Season 2,Shingeki no Kyojin Season 2,Attack on Titan Season 2,進撃の巨人 Season 2,"Eren Jaeger swore to wipe out every last Titan, but in a battle for his life he wound up becoming the thing he hates most. With his new powers, he fights for humanity's freedom facing the monsters that threaten his home. After a bittersweet victory against the Female Titan, Eren finds no time to rest—a horde of Titans is approaching Wall Rose and the battle for humanity continues!

(Source: Funimation)",,2017,,TV,finished,836,12,https://media.kitsu.app/anime/poster_images/8671/original.jpg,,,,,PENDING,,YES,data\anime_csv\items\KITSU_8671.csv,2026-05-02T16:50:48
4732,KITSU,10740,One Punch Man,One Punch Man,One Punch Man,ワンパンマン,"The seemingly ordinary and unimpressive Saitama has a rather unique hobby: being a hero. In order to pursue his childhood dream, he trained relentlessly for three years—and lost all of his hair in the process. Now, Saitama is incredibly powerful, so much so that no enemy is able to defeat him in battle. In fact, all it takes to defeat evildoers with just one punch has led to an unexpected problem—he is no longer able to enjoy the thrill of battling and has become quite bored.

This all changes with the arrival of Genos, a 19-year-old cyborg, who wishes to be Saitama's disciple after seeing what he is capable of. Genos proposes that the two join the Hero Association in order to become certified heroes that will be recognized for their positive contributions to society, and Saitama, shocked that no one knows who he is, quickly agrees. And thus begins the story of One Punch Man, an action-comedy that follows an eccentric individual who longs to fight strong enemies that can hopefully give him the excitement he once felt and just maybe, he'll become popular in the process.

(Source: MAL Rewrite)",,2015,,TV,finished,835,12,https://media.kitsu.app/anime/poster_images/10740/original.jpg,,,,,PENDING,,YES,data\anime_csv\items\KITSU_10740.csv,2026-05-02T16:50:48
4731,KITSU,12268,My Hero Academia Season 2,Boku no Hero Academia 2,My Hero Academia Season 2,僕のヒーローアカデミア２,"Taking off right after the last episode of the first season. The school is temporarily closed due to security. When U.A. restarts, it is announced that the highly anticipated School Sports Festival will soon be taking place. All classes: Hero, Support, General and Business will be participating. Tournaments all around will decide who is the top Hero in training.

(Source: Anime News Network)",,2017,,TV,finished,834,25,https://media.kitsu.app/anime/poster_images/12268/original.jpg,,,,,PENDING,,YES,data\anime_csv\items\KITSU_12268.csv,2026-05-02T16:50:48
4736,KITSU,11614,Your Name.,Kimi no Na wa.,Your Name.,君の名は。,"From director Makoto Shinkai, the innovative mind behind Voices of a Distant Star and 5 Centimeters Per Second, comes a beautiful masterpiece about time, the thread of fate, and the hearts of two young souls.

The day the stars fell, two lives changed forever. High schoolers Mitsuha and Taki are complete strangers living separate lives. But one night, they suddenly switch places. Mitsuha wakes up in Taki’s body, and he in hers. This bizarre occurrence continues to happen randomly, and the two must adjust their lives around each other. Yet, somehow, it works. They build a connection and communicate by leaving notes, messages, and more importantly, an imprint.

When a dazzling comet lights up the night’s sky, it dawns on them. They want something more from this connection—a chance to meet, an opportunity to truly know each other. Tugging at the string of fate, they try to find a way to each other. But distance isn’t the only thing keeping them apart. Is their bond strong enough to face the cruel irony of time? Or is their meeting nothing more than a wish upon the stars?

(Source: FUNimation Films)",,2016,,MOVIE,finished,833,1,https://media.kitsu.app/anime/poster_images/11614/original.jpg,,,,,PENDING,,YES,data\anime_csv\items\KITSU_11614.csv,2026-05-02T16:50:48
4730,KITSU,11469,My Hero Academia,Boku no Hero Academia,My Hero Academia,僕のヒーローアカデミア,"What would the world be like if 80 percent of the population manifested extraordinary superpowers called “Quirks” at age four? Heroes and villains would be battling it out everywhere! Becoming a hero would mean learning to use your power, but where would you go to study? U.A. High's Hero Program of course! But what would you do if you were one of the 20 percent who were born Quirkless?

Middle school student Izuku Midoriya wants to be a hero more than anything, but he hasn't got an ounce of power in him. With no chance of ever getting into the prestigious U.A. High School for budding heroes, his life is looking more and more like a dead end. Then an encounter with All Might, the greatest hero of them all gives him a chance to change his destiny…

(Source: Viz Media)",,2016,,TV,finished,832,13,https://media.kitsu.app/anime/poster_images/11469/original.png,,,,,PENDING,,YES,data\anime_csv\items\KITSU_11469.csv,2026-05-02T16:50:48
4734,KITSU,1376,Death Note,Death Note,Death Note,デスノート,"A shinigami, as a god of death, can kill any person—provided they see their victim's face and write their victim's name in a notebook called a Death Note. One day, Ryuk, bored by the shinigami lifestyle and interested in seeing how a human would use a Death Note, drops one into the human realm.

High school student and prodigy Light Yagami stumbles upon the Death Note and—since he deplores the state of the world—tests the deadly notebook by writing a criminal's name in it. When the criminal dies immediately following his experiment with the Death Note, Light is greatly surprised and quickly recognizes how devastating the power that has fallen into his hands could be.

With this divine capability, Light decides to extinguish all criminals in order to build a new world where crime does not exist and people worship him as a god. Police, however, quickly discover that a serial killer is targeting criminals and, consequently, try to apprehend the culprit. To do this, the Japanese investigators count on the assistance of the best detective in the world: a young and eccentric man known only by the name of L.

(Source: MAL Rewrite)",,2006,,TV,finished,831,37,https://media.kitsu.app/anime/poster_images/1376/original.png,,,,,PENDING,,YES,data\anime_csv\items\KITSU_1376.csv,2026-05-02T16:50:48
4746,KITSU,10877,Assassination Classroom Second Season,Ansatsu Kyoushitsu 2nd Season,Assassination Classroom Second Season,暗殺教室　第２期,"The students return as school is back in session for the second semester. Following their exploits on the island during summer vacation, Class 3-E continues to sharpen their blades with their sights set on their teacher, the slippery Koro-sensei. They have more to worry about than just their teacher, however, as enemy assassins, both old and new, are out for the increased bounty on the octopus' head.

Moreover, their rivals in Class A, as well as Kunugigaoka Junior High's fearsome principal, stand to block Class E from achieving academic excellence. With all of these obstacles opposing them, the group must continue to work together in order to overcome their foes and accomplish their goal of successfully assassinating their teacher.

(Source: MAL Rewrite)",,2016,,TV,finished,831,25,https://media.kitsu.app/anime/poster_images/10877/original.jpg,,,,,PENDING,,YES,data\anime_csv\items\KITSU_10877.csv,2026-05-02T16:50:48
4735,KITSU,3936,Fullmetal Alchemist: Brotherhood,Hagane no Renkinjutsushi: Fullmetal Alchemist,Fullmetal Alchemist: Brotherhood,鋼の錬金術師 FULLMETAL ALCHEMIST,"""In order for something to be obtained, something of equal value must be lost.""

Alchemy is bound by this Law of Equivalent Exchange—something the young brothers Edward and Alphonse Elric only realize after attempting human transmutation: the one forbidden act of alchemy. They pay a terrible price for their transgression—Edward loses his left leg, Alphonse his physical body. It is only by the desperate sacrifice of Edward's right arm that he is able to affix Alphonse's soul to a suit of armor. Devastated and alone, it is the hope that they would both eventually return to their original bodies that gives Edward the inspiration to obtain metal limbs called ""automail"" and become a state alchemist, the Fullmetal Alchemist.

Three years of searching later, the brothers seek the Philosopher's Stone, a mythical relic that allows an alchemist to overcome the Law of Equivalent Exchange. Even with military allies Colonel Roy Mustang, Lieutenant Riza Hawkeye, and Lieutenant Colonel Maes Hughes on their side, the brothers find themselves caught up in a nationwide conspiracy that leads them not only to the true nature of the elusive Philosopher's Stone, but their country's murky history as well. In between finding a serial killer and racing against time, Edward and Alphonse must ask themselves if what they are doing will make them human again... or take away their humanity.

(Source: MAL Rewrite)",,2009,,TV,finished,830,64,https://media.kitsu.app/anime/poster_images/3936/original.png,,,,,PENDING,,YES,data\anime_csv\items\KITSU_3936.csv,2026-05-02T16:50:48
4747,KITSU,8133,Haikyu!!,Haikyuu!!,Haikyu!!,ハイキュー!!,"Inspired after watching a volleyball ace nicknamed ""Little Giant"" in action, small-statured Shouyou Hinata revives the volleyball club at his middle school. The newly-formed team even makes it to a tournament; however, their first match turns out to be their last when they are brutally squashed by the ""King of the Court,"" Tobio Kageyama. Hinata vows to surpass Kageyama, and so after graduating from middle school, he joins Karasuno High School's volleyball team—only to find that his sworn rival, Kageyama, is now his teammate.

Thanks to his short height, Hinata struggles to find his role on the team, even with his superior jumping power. Surprisingly, Kageyama has his own problems that only Hinata can help with, and learning to work together appears to be the only way for the team to be successful. Based on Haruichi Furudate's popular shounen manga of the same name, Haikyuu!! is an exhilarating and emotional sports comedy following two determined athletes as they attempt to patch a heated rivalry in order to make their high school volleyball team the best in Japan.

(Source: MAL)",,2014,,TV,finished,829,25,https://media.kitsu.app/anime/poster_images/8133/original.jpg,,,,,PENDING,,YES,data\anime_csv\items\KITSU_8133.csv,2026-05-02T16:50:48
4748,KITSU,8640,Assassination Classroom,Ansatsu Kyoushitsu,Assassination Classroom,暗殺教室,"When a mysterious creature chops the moon down to a permanent crescent, the students of class 3-E of Kunugigaoka Middle School find themselves confronted with an enormous task: assassinate the creature responsible for the disaster before Earth suffers a similar fate. However, the monster, dubbed Koro-sensei (the indestructible teacher), is able to fly at speeds of up to Mach 20, which he demonstrates freely, leaving any attempt to subdue him in his extraterrestrial dust. Furthermore, the misfits of 3-E soon find that the strange, tentacled beast is more than just indomitable—he is the best teacher they have ever had!

Adapted from the humorous hit manga by Yuusei Matsui, Ansatsu Kyoushitsu tells the story of these junior high pupils as they polish their assassination skills and grow in order to stand strong against the oppressive school system, their own life problems, and one day, Koro-sensei.

(Source: MAL Rewrite)",,2015,,TV,finished,829,22,https://media.kitsu.app/anime/poster_images/8640/original.jpg,,,,,PENDING,,YES,data\anime_csv\items\KITSU_8640.csv,2026-05-02T16:50:48
4744,KITSU,176,Spirited Away,Sen to Chihiro no Kamikakushi,Spirited Away,千と千尋の神隠し,"Stubborn, spoiled, and naïve, 10-year-old Chihiro Ogino is less than pleased when she and her parents discover an abandoned amusement park on the way to their new house. Cautiously venturing inside, she realizes that there is more to this place than meets the eye, as strange things begin to happen once dusk falls. Ghostly apparitions and food that turns her parents into pigs are just the start—Chihiro has unwittingly crossed over into the spirit world. Now trapped, she must summon the courage to live and work amongst spirits, with the help of the enigmatic Haku and the cast of unique characters she meets along the way.
Vivid and intriguing, Sen to Chihiro no Kamikakushi tells the story of Chihiro's journey through an unfamiliar world as she strives to save her parents and return home.
[Written by MAL Rewrite]",,2001,,MOVIE,finished,827,1,https://media.kitsu.app/anime/poster_images/176/original.jpg,,,,,PENDING,,YES,data\anime_csv\items\KITSU_176.csv,2026-05-02T16:50:48
4739,KITSU,8699,The Seven Deadly Sins,Nanatsu no Taizai,The Seven Deadly Sins,七つの大罪,"In a world similar to the European Middle Ages, the feared yet revered Holy Knights of Britannia use immensely powerful magic to protect the region of Britannia and its kingdoms. However, a small subset of the Knights supposedly betrayed their homeland and turned their blades against their comrades in an attempt to overthrow the ruler of Liones. They were defeated by the Holy Knights, but rumors continued to persist that these legendary knights, called the ""Seven Deadly Sins,"" were still alive. Ten years later, the Holy Knights themselves staged a coup d’état, and thus became the new, tyrannical rulers of the Kingdom of Liones.

Based on the best-selling manga series of the same name, Nanatsu no Taizai follows the adventures of Elizabeth, the third princess of the Kingdom of Liones, and her search for the Seven Deadly Sins. With their help, she endeavors to not only take back her kingdom from the Holy Knights, but to also seek justice in an unjust world.

(Source: MAL Rewrite)",,2014,,TV,finished,822,24,https://media.kitsu.app/anime/poster_images/8699/original.jpg,,,,,PENDING,,YES,data\anime_csv\items\KITSU_8699.csv,2026-05-02T16:50:48
3276,JIKAN,7785,Yosuga no Sora,Yojouhan Shinwa Taikei,The Tatami Galaxy,四畳半神話大系,"One autumn evening at a mysterious ramen stand behind the Shimogamo Shrine, a lonely third-year college student bumps into a man with an eggplant-shaped head who calls himself a god of matrimony. Meeting this man causes the student to reflect upon his past two years at college—two years bitterly spent trying to break up couples on campus with his only friend Ozu, a ghoulish-looking man seemingly set on making his life as miserable as possible. Resolving to make the most out of the rest of his college life, the student attempts to ask out the unsociable but kind-hearted underclassman Akashi, yet fails to follow through, prompting him to regret not living out his college life differently. As soon as this thought passes through his head, however, he is hurtled through time and space to the beginning of his years at college and given another chance to live his life.

Surreal, artistic, and mind-bending, Yojouhan Shinwa Taikei chronicles the misadventures of a young man on a journey to make friends, find love, and experience the rose-colored campus life he always dreamed of.

[Written by MAL Rewrite]","[""Award Winning"",""Comedy"",""Mystery"",""Romance"",""Suspense""]",2010,SPRING,TV,FINISHED,86,11,https://myanimelist.net/images/anime/1633/123689l.jpg,https://myanimelist.net/anime/7785/Yojouhan_Shinwa_Taikei,요스가노소라,,GPT,TITLE_ONLY,,YES,data\anime_csv\items\JIKAN_7785.csv,2026-05-02T16:50:48
3303,JIKAN,23273,Your Lie in April,Shigatsu wa Kimi no Uso,Your Lie in April,四月は君の嘘,"Kousei Arima is a child prodigy known as the ""Human Metronome"" for playing the piano with precision and perfection. Guided by a strict mother and rigorous training, Kousei dominates every competition he enters, earning the admiration of his musical peers and praise from audiences. When his mother suddenly passes away, the subsequent trauma makes him unable to hear the sound of a piano, and he never takes the stage thereafter.

Nowadays, Kousei lives a quiet and unassuming life as a junior high school student alongside his friends Tsubaki Sawabe and Ryouta Watari. While struggling to get over his mother's death, he continues to cling to music. His monochrome life turns upside down the day he encounters the eccentric violinist Kaori Miyazono, who thrusts him back into the spotlight as her accompanist. Through a little lie, these two young musicians grow closer together as Kaori tries to fill Kousei's world with color.

[Written by MAL Rewrite]","[""Drama"",""Romance""]",2014,FALL,TV,FINISHED,86,22,https://myanimelist.net/images/anime/1405/143284l.jpg,https://myanimelist.net/anime/23273/Shigatsu_wa_Kimi_no_Uso,4월은 너의 거짓말,,GPT,TITLE_ONLY,,YES,data\anime_csv\items\JIKAN_23273.csv,2026-05-02T16:50:48
