anime_id,provider,external_id,source_title,romaji_title,english_title,native_title,source_description,genres,season_year,season,format,anime_status,average_score,episodes,image_url,site_url,ko_title,ko_description,ko_source,ko_status,ko_failure_reason,pending,item_csv,updated_at
3310,JIKAN,37991,The Promised Neverland Season 2,JoJo no Kimyou na Bouken Part 5: Ougon no Kaze,JoJo's Bizarre Adventure: Golden Wind,ジョジョの奇妙な冒険 黄金の風,"In the coastal city of Naples, corruption is teeming—the police blatantly conspire with outlaws, drugs run rampant around the youth, and the mafia governs the streets with an iron fist. However, various fateful encounters will soon occur.

Enter Giorno Giovanna, a 15-year-old boy with an eccentric connection to the Joestar family, who makes a living out of part-time jobs and pickpocketing. Furthermore, he is gifted with the unexplained Stand ability to give and create life—growing plants from the ground and turning inanimate objects into live animals, an ability he has dubbed ""Gold Experience."" Fascinated by the might of local gangsters, Giorno has dreamed of rising up in their ranks and becoming a ""Gang-Star,"" a feat made possible by his encounter with Bruno Bucciarati, a member of the Passione gang with his own sense of justice.

JoJo no Kimyou na Bouken: Ougon no Kaze follows the endeavors of Giorno after joining Bruno's team while working under Passione, fending off other gangsters and secretly plotting to overthrow their mysterious boss.

[Written by MAL Rewrite]","[""Action"",""Adventure""]",2018,FALL,TV,FINISHED,86,39,https://myanimelist.net/images/anime/1882/94989l.jpg,https://myanimelist.net/anime/37991/JoJo_no_Kimyou_na_Bouken_Part_5__Ougon_no_Kaze,약속의 네버랜드 2기,,GPT,TITLE_ONLY,,YES,data\anime_csv\items\JIKAN_37991.csv,2026-05-02T16:50:48
3261,JIKAN,5,Cowboy Bebop: The Movie,Cowboy Bebop: Tengoku no Tobira,Cowboy Bebop: The Movie,カウボーイビバップ 天国の扉,"Another day, another bounty—such is the life of the often unlucky crew of the Bebop. However, this routine is interrupted when Faye, who is chasing a fairly worthless target on Mars, witnesses an oil tanker suddenly explode, causing mass hysteria. As casualties mount due to a strange disease spreading through the smoke from the blast, a whopping three hundred million woolong price is placed on the head of the supposed perpetrator.

With lives at stake and a solution to their money problems in sight, the Bebop crew springs into action. Spike, Jet, Faye, and Edward, followed closely by Ein, split up to pursue different leads across Alba City. Through their individual investigations, they discover a cover-up scheme involving a pharmaceutical company, revealing a plot that reaches much further than the ragtag team of bounty hunters could have realized.

[Written by MAL Rewrite]","[""Action"",""Sci-Fi""]",,,MOVIE,FINISHED,84,1,https://myanimelist.net/images/anime/1439/93480l.jpg,https://myanimelist.net/anime/5/Cowboy_Bebop__Tengoku_no_Tobira,카우보이 비밥: 더 무비,,GPT,TITLE_ONLY,,YES,data\anime_csv\items\JIKAN_5.csv,2026-05-02T16:50:48
3286,JIKAN,12531,Psycho-Pass 2,Sakamichi no Apollon,Kids on the Slope,坂道のアポロン,"Introverted classical pianist and top student Kaoru Nishimi has just arrived in Kyushu for his first year of high school. Having constantly moved from place to place since his childhood, he abandons all hope of fitting in, preparing himself for another lonely, meaningless year. That is, until he encounters the notorious delinquent Sentarou Kawabuchi.

Sentarou's immeasurable love for jazz music inspires Kaoru to learn more about the genre, and as a result, he slowly starts to break out of his shell, making his very first friend. Kaoru begins playing the piano at after-school jazz sessions, located in the basement of fellow student Ritsuko Mukae's family-owned record shop. As he discovers the immense joy of using his musical talents to bring enjoyment to himself and others, Kaoru's summer might just crescendo into one that he will remember forever.

Sakamichi no Apollon is a heartwarming story of friendship, music, and love that follows three unique individuals brought together by their mutual appreciation for jazz.

[Written by MAL Rewrite]","[""Drama"",""Romance""]",2012,SPRING,TV,FINISHED,83,12,https://myanimelist.net/images/anime/1604/98654l.jpg,https://myanimelist.net/anime/12531/Sakamichi_no_Apollon,사이코패스 2,,GPT,TITLE_ONLY,,YES,data\anime_csv\items\JIKAN_12531.csv,2026-05-02T16:50:48
3291,JIKAN,18617,Assassination Classroom,Girls & Panzer Movie,Girls und Panzer der Film,ガールズ&パンツァー 劇場版,"Having won the 63rd National Sensha-dou tournament, the girls from Ooarai Girls Academy managed to prevent their school from closure by the Japanese Ministry of Education. However, new troubles loom on the horizon: a ministry official argues that the deal was not legally binding and that the Ooarai school carrier is to be decommissioned. Students and their families are frustrated with this injustice and overwhelmed with despair; it seems little can be done to save the school.

Their last glimmer of hope is a proposed match against the All-Stars University Sensha-dou team, consisting of the most talented students from all over the country. Despite Ooarai being severely outnumbered and clearly outclassed, they accept the challenge.

[Written by MAL Rewrite]","[""Action"",""Award Winning""]",,,MOVIE,FINISHED,82,1,https://myanimelist.net/images/anime/1776/91467l.jpg,https://myanimelist.net/anime/18617/Girls___Panzer_Movie,암살교실,,GPT,TITLE_ONLY,,YES,data\anime_csv\items\JIKAN_18617.csv,2026-05-02T16:50:48
3308,JIKAN,33486,My Hero Academia Season 2,Boku no Hero Academia 2nd Season,My Hero Academia Season 2,僕のヒーローアカデミア,"At UA Academy, not even a violent attack can disrupt their most prestigious event: the school sports festival. Renowned across Japan, this festival is an opportunity for aspiring heroes to showcase their abilities, both to the public and potential recruiters.

However, the path to glory is never easy, especially for Izuku Midoriya—whose quirk possesses great raw power but is also cripplingly inefficient. Pitted against his talented classmates, such as the fire and ice wielding Shouto Todoroki, Izuku must utilize his sharp wits and master his surroundings to achieve victory and prove to the world his worth.

[Written by MAL Rewrite]","[""Action""]",2017,SPRING,TV,FINISHED,81,25,https://myanimelist.net/images/anime/12/85221l.jpg,https://myanimelist.net/anime/33486/Boku_no_Hero_Academia_2nd_Season,나의 히어로 아카데미아 2기,,GPT,TITLE_ONLY,,YES,data\anime_csv\items\JIKAN_33486.csv,2026-05-02T16:50:48
3278,JIKAN,9919,Blue Exorcist,Ao no Exorcist,Blue Exorcist,青の祓魔師,"Humans and demons are two sides of the same coin, as are Assiah and Gehenna, their respective worlds. The only way to travel between the realms is by the means of possession, like in ghost stories. However, Satan, the ruler of Gehenna, cannot find a suitable host to possess and therefore, remains imprisoned in his world. In a desperate attempt to conquer Assiah, he sends his son instead, intending for him to eventually grow into a vessel capable of possession by the demon king.

Ao no Exorcist follows Rin Okumura who appears to be an ordinary, somewhat troublesome teenager—that is until one day he is ambushed by demons. His world turns upside down when he discovers that he is in fact the very son of Satan and that his demon father wishes for him to return so they can conquer Assiah together. Not wanting to join the king of Gehenna, Rin decides to begin training to become an exorcist so that he can fight to defend Assiah alongside his brother Yukio.

[Written by MAL Rewrite]","[""Action"",""Supernatural""]",2011,SPRING,TV,FINISHED,75,25,https://myanimelist.net/images/anime/10/75195l.jpg,https://myanimelist.net/anime/9919/Ao_no_Exorcist,블루 엑소시스트,,GPT,TITLE_ONLY,,YES,data\anime_csv\items\JIKAN_9919.csv,2026-05-02T16:50:48
3284,JIKAN,11111,Another,Another,Another,アナザー,"In class 3-3 of Yomiyama North Junior High, transfer student Kouichi Sakakibara makes his return after taking a sick leave for the first month of school. Among his new classmates, he is inexplicably drawn toward Mei Misaki—a reserved girl with an eyepatch whom he met in the hospital during his absence. But none of his classmates acknowledge her existence; they warn him not to acquaint himself with things that do not exist. Against their words of caution, Kouichi befriends Mei—soon learning of the sinister truth behind his friends' apprehension.

The ominous rumors revolve around a former student of the class 3-3. However, no one will share the full details of the grim event with Kouichi. Engrossed in the curse that plagues his class, Kouichi sets out to discover its connection to his new friend. As a series of tragedies arise around them, it is now up to Kouichi, Mei, and their classmates to unravel the eerie mystery—but doing so will come at a hefty price.

[Written by MAL Rewrite]","[""Horror"",""Mystery""]",2012,WINTER,TV,FINISHED,75,12,https://myanimelist.net/images/anime/4/75509l.jpg,https://myanimelist.net/anime/11111/Another,어나더,,GPT,TITLE_ONLY,,YES,data\anime_csv\items\JIKAN_11111.csv,2026-05-02T16:50:48
3275,JIKAN,6922,Fullmetal Alchemist,Fate/stay night Movie: Unlimited Blade Works,Fate/stay night: Unlimited Blade Works,劇場版 Fate/stay night UNLIMITED BLADE WORKS,"In Fuyuki City, the Fifth Holy Grail War is about to commence a lengthy battle of blood, death, and misery. High school student Rin Toosaka has trained her entire life for this moment—to become a magus capable of being a Master in the war. Summoning her Servant known as Archer, Rin finally sets foot into the battle.

Discovering that one of her acquaintances, Shirou Emiya, is drawn into the war as well, Rin offers to form an alliance for the time being. And as the two of them grow closer, Rin begins to learn more about Shirou's fate and ideals. Nevertheless, her goal remains the same: to win the all-powerful relic that can fulfill the wishes of those who are victorious after the war—the Holy Grail.

[Written by MAL Rewrite]","[""Action"",""Fantasy""]",,,MOVIE,FINISHED,74,1,https://myanimelist.net/images/anime/1889/95111l.jpg,https://myanimelist.net/anime/6922/Fate_stay_night_Movie__Unlimited_Blade_Works,강철의 연금술사,,GPT,TITLE_ONLY,,YES,data\anime_csv\items\JIKAN_6922.csv,2026-05-02T16:50:48
3281,JIKAN,10620,Future Diary,Mirai Nikki (TV),The Future Diary,未来日記,"Yukiteru Amano is a shy middle schooler who regularly keeps track of what he does in his daily life by writing down all of his activities on his phone—a digital diary. Despite having no friends at school, Yukiteru is frequently seen talking to his supposedly imaginary friends Deus Ex Machina, the god of time and space; and Deus' servant, Mur Mur.

One day, Yukiteru wakes up and discovers that certain events of his day are preemptively displayed on his cellphone. While initially dismissing it as a coincidence, he slowly realizes that the incidents written in his phone actually take place in the near future. After spending the day benefiting from this new asset, Yukiteru learns that his classmate Yuno Gasai possesses a similar diary.

As the two team up to defeat an odd pursuer and head back to their respective homes, Deus Ex Machina explains that they—alongside 10 other contestants—have been drawn into a survival game whose victor will become the deity's successor. With no other options, Yukiteru and Yuno must use their cellphones—now called ""Future Diaries""—to survive this unforgiving battle royale.

[Written by MAL Rewrite]","[""Action"",""Supernatural"",""Suspense""]",2011,FALL,TV,FINISHED,74,26,https://myanimelist.net/images/anime/13/33465l.jpg,https://myanimelist.net/anime/10620/Mirai_Nikki_TV,미래일기,,GPT,TITLE_ONLY,,YES,data\anime_csv\items\JIKAN_10620.csv,2026-05-02T16:50:48
3289,JIKAN,16417,Haven`t You Heard? I`m Sakamoto,Tamako Market,Tamako Market,たまこまーけっと,"Inside the Usagiyama Shopping District lies an eccentric but close-knit community of business owners. Tamako Kitashirakawa, a clumsy though adorable teenage girl, belongs to a family of mochi bakers who own a quaint shop called Tama-ya. One day, Tamako stumbles upon a talking bird that presents himself as royalty from a distant land. Dera Mochimazzi, as he calls himself, states that he’s seeking a bride for his country’s prince. Intent on his mission, Dera follows Tamako home and develops an addiction to mochi, becoming painfully overweight and subsequently unable to fly back to his homeland; thus, he takes up residence with Tamako's family and becomes the community’s beloved mascot.

Meanwhile, Tamako's friend, Mochizou Ooji, continues to hide his true feelings for her. Their fathers are fierce mochi rivals, but will it be enough to drive a wedge between Tamako and Mochizou? And just what will happen to Dera's task of finding his prince’s destined bride?

[Written by MAL Rewrite]","[""Slice of Life""]",2013,WINTER,TV,FINISHED,74,12,https://myanimelist.net/images/anime/1669/122434l.jpg,https://myanimelist.net/anime/16417/Tamako_Market,"들었어? 나, 사카모토야",,GPT,TITLE_ONLY,,YES,data\anime_csv\items\JIKAN_16417.csv,2026-05-02T16:50:48
3282,JIKAN,10719,Sword Art Online II,Boku wa Tomodachi ga Sukunai,Haganai: I don't have many friends,僕は友達が少ない,"When Kodaka Hasegawa finds out that he will be transferring to a new school, he is determined to make a positive impression, and maybe even some friends. However, Kodaka discovers he is out of luck when he immediately gets labeled as a violent delinquent due to his blond hair and intimidating expression. Although a month has passed, Kodaka is still alone thanks to his notorious reputation. However, his life begins to change when he finds fellow loner Yozora Mikazuki talking to her imaginary friend in an empty classroom.

After sharing stories of their lonely high school life, Kodaka and Yozora decide to overcome the difficulties of making friends together by starting the Neighbor's Club. Created for people who don't have friends, daily activities involve learning social skills and how to fit in, which will hopefully allow them to make friends. Joined by the eroge-loving Sena Kashiwazaki, and other eccentric outcasts, Kodaka may finally have managed to find people he can call friends, in this club filled with hilarious oddballs.

[Written by MAL Rewrite]","[""Comedy"",""Romance"",""Ecchi""]",2011,FALL,TV,FINISHED,71,12,https://myanimelist.net/images/anime/8/32873l.jpg,https://myanimelist.net/anime/10719/Boku_wa_Tomodachi_ga_Sukunai,소드 아트 온라인 II,,GPT,TITLE_ONLY,,YES,data\anime_csv\items\JIKAN_10719.csv,2026-05-02T16:50:48
4749,JIKAN,41370,Childhood Friends with Benefits: It's Because Everyone Says That Being A Virgin Boy or Girl is Embarrassing,Sex Friend Osananajimi: Shojo to Doutei wa Hazukashii tte Minna ga Iu kara - The Animation,Childhood Friends with Benefits: It's Because Everyone Says That Being A Virgin Boy or Girl is Embarrassing,セクフレ幼馴染 ~処女と童貞は恥ずかしいってみんなが言うから~ THE ANIMATION,"After more than 15 years, a fateful encounter at a highschool reunion brought 2 childhood friends back together to reminisce about their three years spent together. they were each others' 'first time' and more than sex friends but less than lovers.","[""Hentai""]",,,OVA,FINISHED,68,1,https://myanimelist.net/images/anime/1542/106244l.jpg,https://myanimelist.net/anime/41370/Sex_Friend_Osananajimi__Shojo_to_Doutei_wa_Hazukashii_tte_Minna_ga_Iu_kara_-_The_Animation,,,,PENDING,,YES,data\anime_csv\items\JIKAN_41370.csv,2026-05-02T16:50:48
3288,JIKAN,15125,From the New World,Teekyuu,Teekyu,てーきゅう,"Teekyuu is all about the wacky antics of four schoolgirls—Kanae Shinjou gets bored easily and often breaks the laws of physics to get what she wants; Nasuno Takamiya is incredibly rich and knows how to make things go her way; Marimo Bandou would probably get arrested from her actions like eating panties or kidnapping children; and Yuri Oshimoto, their ordinary junior, rounds out the eccentric bunch that forms the sole members of their school's tennis club. 

Despite their interest in learning the sport, the older girls prefer messing around, while Yuri, being the only one who actually knows how to play and the most mature in spite of being younger, has to deal with her seniors' out of control behavior. 

When these four girls come together, insanity ensues in this lightning-paced comedy about a tennis club that doesn't really play tennis. 

[Written by MAL Rewrite]","[""Comedy"",""Sports""]",2012,FALL,TV,FINISHED,66,12,https://myanimelist.net/images/anime/1703/98658l.jpg,https://myanimelist.net/anime/15125/Teekyuu,신세계에서,,GPT,TITLE_ONLY,,YES,data\anime_csv\items\JIKAN_15125.csv,2026-05-02T16:50:48
4751,JIKAN,23363,Ore no Imouto ga Konnani Kawaii Wake ga Nai.: Ore no Imouto ga Konnani Eroge na Wake Nai,Ore no Imouto ga Konnani Kawaii Wake ga Nai.: Ore no Imouto ga Konnani Eroge na Wake Nai,Ore no Imouto ga Konnani Kawaii Wake ga Nai.: Ore no Imouto ga Konnani Eroge na Wake Nai,俺の妹がこんなに可愛いわけがない。 俺の妹がこんなにエロゲーなわけがない〜逆襲の秋美〜,Gal game animation special included in DVD/Blu-ray Vol.8.,"[""Comedy"",""Romance""]",,,SPECIAL,FINISHED,64,1,https://myanimelist.net/images/anime/9/60363l.jpg,https://myanimelist.net/anime/23363/Ore_no_Imouto_ga_Konnani_Kawaii_Wake_ga_Nai__Ore_no_Imouto_ga_Konnani_Eroge_na_Wake_Nai,,,,PENDING,,YES,data\anime_csv\items\JIKAN_23363.csv,2026-05-02T16:50:48
4750,JIKAN,6448,Prince Planet,Yuusei Shounen Papii,Prince Planet,遊星少年パピイ,"Tells the story of a member of the Universal Peace Corps from the Planet Radion coming to Earth on a mission to determine if this world meets standards for membership in the Galactic Union of Worlds and assist its inhabitants during his stay. While on his mission Prince Planet adopts the identity of an Earth boy named Bobby and gains comrades who work together alongside him combating evil forces both alien and terrestrial. 

(Source: Wikipedia)","[""Action"",""Sci-Fi""]",1965,SUMMER,TV,FINISHED,56,52,https://myanimelist.net/images/anime/8/46719l.jpg,https://myanimelist.net/anime/6448/Yuusei_Shounen_Papii,,,,PENDING,,YES,data\anime_csv\items\JIKAN_6448.csv,2026-05-02T16:50:48
443,JIKAN,62549,Death Stranding: Mosquito,Death Stranding: Mosquito,Death Stranding: Mosquito,DEATH STRANDING MOSQUITO,,"[""Sci-Fi""]",,,MOVIE,NOT_YET_RELEASED,,1,https://myanimelist.net/images/anime/1379/152196l.jpg,https://myanimelist.net/anime/62549/Death_Stranding__Mosquito,데스 스트랜딩: 모기,,GPT,TITLE_ONLY,,NO,data\anime_csv\items\JIKAN_62549.csv,2026-05-02T16:50:48
642,JIKAN,61238,Chikuwa Senki: Ore no Kawaii de Chikyuu Shinryaku,Chikuwa Senki: Ore no Kawaii de Chikyuu Shinryaku,Chikuwa Senki: Ore no Kawaii de Chikyuu Shinryaku,ちくわ戦記～おれのカワイイで地球侵略～,,"[""Comedy""]",2025,SPRING,TV,FINISHED,,12,https://myanimelist.net/images/anime/1617/149999l.jpg,https://myanimelist.net/anime/61238/Chikuwa_Senki__Ore_no_Kawaii_de_Chikyuu_Shinryaku,치쿠와 전기: 내 귀여움으로 지구 침략,,GPT,TITLE_ONLY,,NO,data\anime_csv\items\JIKAN_61238.csv,2026-05-02T16:50:48
3296,JIKAN,20594,Assassination Classroom Season 2,Assassination Classroom Season 2,Assassination Classroom Season 2,暗殺教室 第2期,,,,,,,,,,,암살교실 2기,,GPT,TITLE_ONLY,,NO,data\anime_csv\items\JIKAN_20594.csv,2026-05-02T16:50:48
3298,JIKAN,21234,ERASED,ERASED,ERASED,僕だけがいない街,,,,,,,,,,,어나더,,GPT,TITLE_ONLY,,NO,data\anime_csv\items\JIKAN_21234.csv,2026-05-02T16:50:48
3299,JIKAN,21459,My Hero Academia Season 2,My Hero Academia Season 2,My Hero Academia Season 2,僕のヒーローアカデミア 第2期,,,,,,,,,,,나의 히어로 아카데미아 2기,,GPT,TITLE_ONLY,,NO,data\anime_csv\items\JIKAN_21459.csv,2026-05-02T16:50:48
3302,JIKAN,22370,One Punch Man OVA,One Punch Man OVA,One Punch Man OVA,ワンパンマン OVA,,,,,,,,,,,원펀맨 OVA,,GPT,TITLE_ONLY,,NO,data\anime_csv\items\JIKAN_22370.csv,2026-05-02T16:50:48
3313,JIKAN,97938,Boruto: Naruto Next Generations,Boruto: Naruto Next Generations,Boruto: Naruto Next Generations,BORUTO-ボルト-,,,,,,,,,,,보루토: 나루토 다음 세대,,GPT,TITLE_ONLY,,NO,data\anime_csv\items\JIKAN_97938.csv,2026-05-02T16:50:48
